{
  "format": "tessera-hologram-params",
  "version": 1,
  "archetype": "case",
  "variant": "slim",
  "id": "case-slim",
  "title": "Second Example (slim case)",
  "synthetic": true,
  "sources": [
    {
      "id": "request",
      "kind": "user_request",
      "title": "Synthetic example request",
      "rights": "synthetic"
    }
  ],
  "facts": [
    {
      "key": "title",
      "value": "Second Example",
      "certainty": "user_supplied",
      "source": "request",
      "note": "invented for this synthetic example"
    },
    {
      "key": "artist",
      "value": "Example Ensemble",
      "certainty": "user_supplied",
      "source": "request",
      "note": "invented for this synthetic example"
    }
  ]
}
