{
  "format": "tessera-hologram-params",
  "version": 1,
  "archetype": "vessel",
  "variant": "bottle",
  "id": "vessel-bottle",
  "title": "Example Lager (bottle)",
  "synthetic": true,
  "sources": [
    {
      "id": "request",
      "kind": "user_request",
      "title": "Synthetic example request",
      "rights": "synthetic"
    }
  ],
  "facts": [
    {
      "key": "title",
      "value": "Example Lager",
      "certainty": "user_supplied",
      "source": "request",
      "note": "invented for this synthetic example"
    },
    {
      "key": "brewery",
      "value": "Example Brewing Co.",
      "certainty": "user_supplied",
      "source": "request",
      "note": "invented for this synthetic example"
    },
    {
      "key": "style",
      "value": "Pale lager",
      "certainty": "user_supplied",
      "source": "request",
      "note": "invented for this synthetic example"
    },
    {
      "key": "abv",
      "value": 4.8,
      "certainty": "user_supplied",
      "source": "request",
      "note": "invented for this synthetic example",
      "unit": "%"
    }
  ]
}
