{
  "format": "tessera-hologram-params",
  "version": 1,
  "archetype": "case",
  "variant": "box",
  "id": "case-box",
  "title": "Example Collection (box set)",
  "synthetic": true,
  "sources": [
    {
      "id": "request",
      "kind": "user_request",
      "title": "Synthetic example request",
      "rights": "synthetic"
    }
  ],
  "facts": [
    {
      "key": "title",
      "value": "Example Collection",
      "certainty": "user_supplied",
      "source": "request",
      "note": "invented for this synthetic example"
    },
    {
      "key": "artist",
      "value": "Example Orchestra",
      "certainty": "user_supplied",
      "source": "request",
      "note": "invented for this synthetic example"
    }
  ],
  "params": {
    "discs": 4
  }
}
