{
  "format": "tessera-hologram-params",
  "version": 1,
  "archetype": "case",
  "variant": "digipak",
  "id": "case-digipak",
  "title": "Example Sessions (digipak)",
  "synthetic": true,
  "sources": [
    {
      "id": "request",
      "kind": "user_request",
      "title": "Synthetic example request",
      "rights": "synthetic"
    },
    {
      "id": "generated-art",
      "kind": "generated",
      "title": "Abstract pattern generated by the toolkit (png.py)",
      "rights": "synthetic"
    }
  ],
  "facts": [
    {
      "key": "title",
      "value": "Example Sessions",
      "certainty": "user_supplied",
      "source": "request",
      "note": "invented for this synthetic example"
    },
    {
      "key": "artist",
      "value": "Example Trio",
      "certainty": "user_supplied",
      "source": "request",
      "note": "invented for this synthetic example"
    }
  ],
  "assets": [
    {
      "id": "disc-art",
      "path": "assets/disc-cover.png",
      "sha256": "2a5f94b21f63a49eb49b7bc39b3c93bf1a2952267774ffee8ae1297f92fee8af",
      "media_type": "image/png",
      "rights": "synthetic",
      "provenance": "generated-decorative",
      "source": "generated-art"
    }
  ],
  "artwork": {
    "cover-front": "disc-art",
    "disc": "disc-art"
  }
}
